{
  "id": "rt-d3-q14-d5e7f9a1-4b6c-4d8e-0f3a-2b9c5d7e4f6a",
  "topic": {
    "section": "MATH",
    "domain": "Geometry_Trig",
    "subtopic": "right_triangles"
  },
  "difficulty": {
    "overall": 3,
    "conceptual": 3.0,
    "procedural": 3.5,
    "computational": 3.0
  },
  "stem": "A surveyor wants to find the height of a cell tower. From point A on level ground, the angle of elevation to the top of the tower is θ, where tan θ = 3/4. The surveyor walks 14 meters closer to the tower to point B, where the angle of elevation is φ, and tan φ = 3/2. What is the height of the cell tower, in meters?",
  "choices": [
    { "label": "A", "text": "14", "isCorrect": false },
    { "label": "B", "text": "21", "isCorrect": true },
    { "label": "C", "text": "28", "isCorrect": false },
    { "label": "D", "text": "42", "isCorrect": false }
  ],
  "correctAnswer": "B",
  "explanation": "Let d be the horizontal distance from point B to the base of the tower, and h be the height of the tower. From point B: tan φ = h/d, so h = (3/2)d. From point A (which is 14 m farther): tan θ = h/(d + 14), so h = (3/4)(d + 14). Setting these equal: (3/2)d = (3/4)(d + 14). Multiply both sides by 4: 6d = 3(d + 14) = 3d + 42. So 3d = 42, giving d = 14. Therefore h = (3/2)(14) = 21 meters. Check: h/(d + 14) = 21/28 = 3/4, which confirms tan θ = 3/4.",
  "distractorRationale": {
    "A": "Solves the system correctly for d = 14 but reports the horizontal distance from B to the tower base instead of the height = 14",
    "B": "Correct: Sets up two equations h = (3/2)d and h = (3/4)(d + 14), solves to get d = 14, then h = (3/2)(14) = 21",
    "C": "Computes d + 14 = 14 + 14 = 28, giving the total horizontal distance from point A to the tower base instead of the height = 28",
    "D": "Pairs the larger tangent ratio with the larger distance: uses tan φ with (d + 14) instead of d, computing h = (3/2)(28) = 42"
  },
  "hasImage": true,
  "imageDescription": "A diagram showing a vertical cell tower on level ground. Two points, A and B, are on the ground to the left of the tower, with A farther from the tower and B closer. The distance between A and B is labeled 14 m. From point A, a dashed line to the top of the tower shows angle of elevation θ. From point B, a dashed line to the top of the tower shows angle of elevation φ. The height of the tower is marked with a question mark.",
  "requiresCalculator": false,
  "answerType": "multiple_choice",
  "metadata": {
    "generatedAt": "2026-02-18T14:30:00.000Z",
    "promptVersion": "1.3.0",
    "modelUsed": "claude-sonnet-4-5-20250929",
    "generationId": "iter1-d3-q14"
  }
}
