{
  "id": "a3f7c1e2-84b5-4d6a-9f2e-1c8b3d5e7a09",
  "topic": {
    "section": "MATH",
    "domain": "Advanced_Math",
    "subtopic": "nonlinear_functions"
  },
  "difficulty": {
    "overall": 5,
    "conceptual": 5,
    "procedural": 5,
    "computational": 5
  },
  "stem": "Let $f(x) = x^2 - 4x + 7$, and define $g(x) = f(f(x))$. What is the minimum value of $g(x)$?",
  "choices": [
    {
      "label": "A",
      "text": "$3$",
      "isCorrect": false
    },
    {
      "label": "B",
      "text": "$4$",
      "isCorrect": true
    },
    {
      "label": "C",
      "text": "$9$",
      "isCorrect": false
    },
    {
      "label": "D",
      "text": "$28$",
      "isCorrect": false
    }
  ],
  "correctAnswer": "B",
  "explanation": "Step 1: Find the range of $f(x)$. Complete the square: $f(x) = (x-2)^2 + 3$. The vertex is at $(2, 3)$, so the minimum value of $f(x)$ is $3$. Therefore the range of $f$ is $[3, \\infty)$.\n\nStep 2: Express $g(x) = f(f(x))$. Let $u = f(x)$, so $g(x) = f(u) = u^2 - 4u + 7 = (u-2)^2 + 3$. Since $f$ is a composition, we need to minimize $h(u) = (u-2)^2 + 3$ subject to $u \\geq 3$ (because $u = f(x) \\geq 3$ for all real $x$).\n\nStep 3: Minimize $h(u) = (u-2)^2 + 3$ for $u \\geq 3$. The unconstrained minimum of $h(u)$ is at $u = 2$, giving $h(2) = 3$. However, $u = 2$ is not in the feasible range $[3, \\infty)$. Since $h(u)$ is increasing for $u > 2$, the constrained minimum occurs at the boundary $u = 3$: $h(3) = (3-2)^2 + 3 = 1 + 3 = 4$.\n\nStep 4: Confirm $u = 3$ is achievable. We need $f(x) = 3$, i.e., $(x-2)^2 + 3 = 3$, so $(x-2)^2 = 0$, giving $x = 2$. Check: $g(2) = f(f(2)) = f(3) = 9 - 12 + 7 = 4$. ✓\n\nThe minimum value of $g(x)$ is $\\boxed{4}$.",
  "distractorRationale": {
    "A": "Error: The student minimizes $h(u) = (u-2)^2 + 3$ over all real numbers without accounting for the constraint $u = f(x) \\geq 3$. The unconstrained minimum of $h$ is $h(2) = (2-2)^2 + 3 = 3$. This ignores that $u = 2$ is outside the range of $f(x)$ and is therefore unreachable.",
    "B": "Correct. The minimum value of $g(x)$ is $4$, achieved at $x = 2$.",
    "C": "Error: The student computes $[\\min f(x)]^2 = 3^2 = 9$, incorrectly treating $g(x) = f(f(x))$ as though it equals $[f(x)]^2$. This confuses function composition with squaring the output.",
    "D": "Error: The student evaluates $g$ at $x = 0$ as a guess for where the minimum occurs. $g(0) = f(f(0)) = f(0^2 - 4(0) + 7) = f(7) = 49 - 28 + 7 = 28$. This misidentifies $x = 0$ as a candidate for the minimum rather than applying calculus or completing the square."
  },
  "hasImage": false,
  "requiresCalculator": false,
  "answerType": "multiple_choice",
  "metadata": {
    "generatedAt": "2026-02-20T00:00:00.000Z",
    "promptVersion": "1.3.0",
    "modelUsed": "claude-sonnet-4-6",
    "generationId": "b2e4f6a8-c0d2-4e1f-8a3b-5c7d9e1f3a5b"
  }
}
