{
  "id": "b3e7f1a2-9c4d-4e8b-a5f6-1d2c3e4f5a6b",
  "topic": {
    "section": "MATH",
    "domain": "Advanced_Math",
    "subtopic": "equivalent_expressions"
  },
  "difficulty": {
    "overall": 4,
    "conceptual": 4.2,
    "procedural": 4.0,
    "computational": 4.3
  },
  "stem": "Which of the following is equivalent to $\\dfrac{x^3 - 8}{x - 2}$ for $x \\neq 2$?",
  "choices": [
    {
      "label": "A",
      "text": "$x^2 - 2x + 4$",
      "isCorrect": false
    },
    {
      "label": "B",
      "text": "$x^2 + 2x + 4$",
      "isCorrect": true
    },
    {
      "label": "C",
      "text": "$x^2 + 2x - 4$",
      "isCorrect": false
    },
    {
      "label": "D",
      "text": "$x^2 + 4$",
      "isCorrect": false
    }
  ],
  "correctAnswer": "B",
  "explanation": "To simplify $\\dfrac{x^3 - 8}{x - 2}$, recognize that $x^3 - 8$ is a difference of cubes.\n\nThe difference of cubes identity states: $a^3 - b^3 = (a - b)(a^2 + ab + b^2)$.\n\nHere $a = x$ and $b = 2$, so:\n$$x^3 - 8 = (x - 2)(x^2 + 2x + 4)$$\n\nVerification by expanding: $(x-2)(x^2+2x+4) = x^3+2x^2+4x-2x^2-4x-8 = x^3-8$ ✓\n\nTherefore:\n$$\\frac{x^3 - 8}{x - 2} = \\frac{(x-2)(x^2 + 2x + 4)}{x - 2} = x^2 + 2x + 4$$",
  "distractorRationale": {
    "A": "Incorrect. A student who misapplies the difference of cubes formula might write $(x-2)(x^2-2x+4)$ instead, confusing the sign of the middle term. The correct factorization uses $+ab$, not $-ab$, giving $x^2+2x+4$, not $x^2-2x+4$.",
    "B": "Correct. Applying the difference of cubes identity $a^3-b^3=(a-b)(a^2+ab+b^2)$ with $a=x, b=2$ gives $(x-2)(x^2+2x+4)$, and canceling $(x-2)$ yields $x^2+2x+4$.",
    "C": "Incorrect. A student who correctly finds the middle term $+2x$ but changes the sign of the constant from $+4$ to $-4$ arrives at this distractor. This is a sign error in the last term of the difference of cubes factor.",
    "D": "Incorrect. A student who drops the middle term $2x$ when applying the difference of cubes—perhaps recalling only $x^2 + b^2$ rather than $x^2 + bx + b^2$—arrives at $x^2+4$. This results from an incomplete application of the formula."
  },
  "hasImage": false,
  "requiresCalculator": false,
  "answerType": "multiple_choice",
  "metadata": {
    "generatedAt": "2026-02-20T00:00:00.000Z",
    "promptVersion": "1.3.0",
    "modelUsed": "claude-sonnet-4-6",
    "generationId": "c1d2e3f4-a5b6-4c7d-8e9f-0a1b2c3d4e5f"
  }
}
