{
  "id": "6de63b74-66e0-490f-92a1-a17eb5952bde",
  "topic": {
    "section": "MATH",
    "domain": "Advanced_Math",
    "subtopic": "nonlinear_functions"
  },
  "difficulty": {
    "overall": 2,
    "conceptual": 2.2,
    "procedural": 2.0,
    "computational": 2.3
  },
  "stem": "The function $f$ is defined by $f(x) = x^2 - 6x + 11$. What is the minimum value of $f(x)$?",
  "choices": [
    {
      "label": "A",
      "text": "$2$",
      "isCorrect": true
    },
    {
      "label": "B",
      "text": "$3$",
      "isCorrect": false
    },
    {
      "label": "C",
      "text": "$11$",
      "isCorrect": false
    },
    {
      "label": "D",
      "text": "$-2$",
      "isCorrect": false
    }
  ],
  "correctAnswer": "A",
  "explanation": "To find the minimum value of $f(x) = x^2 - 6x + 11$, complete the square or use the vertex formula.\n\nUsing the axis of symmetry: $x = -\\frac{b}{2a} = -\\frac{-6}{2(1)} = \\frac{6}{2} = 3$.\n\nSubstitute $x = 3$ into $f(x)$:\n$$f(3) = (3)^2 - 6(3) + 11 = 9 - 18 + 11 = 2.$$\n\nSince the coefficient of $x^2$ is positive ($a = 1 > 0$), the parabola opens upward, so the vertex is the minimum. The minimum value is $\\boxed{2}$.",
  "distractorRationale": {
    "A": "Correct. The vertex is at $x = 3$, and $f(3) = 9 - 18 + 11 = 2$.",
    "B": "Confuses the minimum value with the $x$-coordinate of the vertex. The vertex occurs at $x = 3$, but the minimum value of $f$ is $f(3) = 2$, not $3$.",
    "C": "Uses the $y$-intercept $f(0) = 11$ instead of evaluating the function at the vertex. The $y$-intercept is not the minimum.",
    "D": "Arithmetic error when evaluating $f(3)$: incorrectly computes $9 - 18 + 11 = -2$ instead of the correct $9 - 18 + 11 = 2$."
  },
  "hasImage": false,
  "requiresCalculator": false,
  "answerType": "multiple_choice",
  "metadata": {
    "generatedAt": "2026-02-20T00:00:00.000Z",
    "promptVersion": "1.3.0",
    "modelUsed": "claude-sonnet-4-6",
    "generationId": "1d6599d2-3ef1-4d36-8f2a-50b582236b5e"
  }
}
