{
  "id": "f7c2d5e6-8a4b-4c3f-e1d6-3b7a2f9c5e8d",
  "topic": {
    "section": "MATH",
    "domain": "Algebra",
    "subtopic": "linear_functions"
  },
  "difficulty": {
    "overall": 2,
    "conceptual": 1.9,
    "procedural": 2.1,
    "computational": 1.8
  },
  "stem": "The table below shows selected values of the linear function $g$.\n\n| $x$ | $g(x)$ |\n|-----|--------|\n| $1$ | $9$    |\n| $3$ | $15$   |\n| $5$ | $21$   |\n\nWhat is the $y$-intercept of the graph of $g$ in the $xy$-plane?",
  "choices": [
    {
      "label": "A",
      "text": "$3$",
      "isCorrect": false
    },
    {
      "label": "B",
      "text": "$6$",
      "isCorrect": true
    },
    {
      "label": "C",
      "text": "$9$",
      "isCorrect": false
    },
    {
      "label": "D",
      "text": "$12$",
      "isCorrect": false
    }
  ],
  "correctAnswer": "B",
  "explanation": "First, find the slope using any two points from the table. Using $(1, 9)$ and $(3, 15)$:\n$$m = \\frac{15 - 9}{3 - 1} = \\frac{6}{2} = 3$$\n\nNext, use the slope and one point to find the y-intercept $b$ in $g(x) = 3x + b$. Substituting the point $(1, 9)$:\n$$9 = 3(1) + b$$\n$$9 = 3 + b$$\n$$b = 6$$\n\nThe y-intercept of the graph of $g$ is $6$. This can be verified: $g(0) = 3(0) + 6 = 6$.",
  "distractorRationale": {
    "A": "Reads the slope $m = 3$ as the y-intercept instead of computing $g(0)$ using the slope-intercept form.",
    "B": "Correct. The slope is $\\frac{15-9}{3-1} = 3$, and substituting $(1, 9)$ gives $9 = 3(1) + b$, so $b = 6$.",
    "C": "Uses the value $g(1) = 9$ as the y-intercept, mistakenly treating the function value at $x = 1$ as the value at $x = 0$.",
    "D": "Extends the pattern in the wrong direction by adding the slope to $g(1)$ instead of subtracting: $9 + 3 = 12$ instead of $9 - 3 = 6$."
  },
  "hasImage": false,
  "requiresCalculator": false,
  "answerType": "multiple_choice",
  "metadata": {
    "generatedAt": "2026-02-20T00:00:00.000Z",
    "promptVersion": "1.6.0",
    "modelUsed": "claude-sonnet-4-6",
    "generationId": "e5b9c7f4-1d3a-4e8c-f2b5-4a8d6e3f1c9b"
  }
}
