{
  "id": "550e8400-e29b-41d4-a716-446655440000",
  "topic": {
    "section": "MATH",
    "domain": "Problem_Solving",
    "subtopic": "units"
  },
  "difficulty": {
    "overall": 3,
    "conceptual": 3,
    "procedural": 3.2,
    "computational": 2.8
  },
  "stem": "A water bottling facility fills bottles at a constant rate of 2,400 milliliters per minute. Each bottle has a capacity of 750 milliliters. If the facility operates for 45 minutes, how many bottles can be completely filled during this time?",
  "choices": [
    {
      "label": "A",
      "text": "72",
      "isCorrect": false
    },
    {
      "label": "B",
      "text": "108",
      "isCorrect": false
    },
    {
      "label": "C",
      "text": "144",
      "isCorrect": true
    },
    {
      "label": "D",
      "text": "1,620",
      "isCorrect": false
    }
  ],
  "correctAnswer": "C",
  "explanation": "To find how many bottles can be filled, we need to:\n\n**Step 1**: Calculate the total volume of water produced in 45 minutes.\n\nRate = 2,400 mL/minute\nTime = 45 minutes\nTotal volume = $2,400 \\times 45 = 108,000$ mL\n\n**Step 2**: Divide the total volume by the capacity of each bottle.\n\nBottle capacity = 750 mL\nNumber of bottles = $\\frac{108,000}{750} = 144$ bottles\n\nTherefore, 144 bottles can be completely filled in 45 minutes.",
  "distractorRationale": {
    "A": "This answer results from dividing 2,400 by 45 first (getting 53.33), then attempting to work with that intermediate value incorrectly, or from confusing the rate with a total quantity and calculating 2,400 ÷ 750 × 45 ÷ 15 = 72.",
    "B": "This answer results from dividing the time by the bottle capacity and then multiplying by something incorrectly: 45 ÷ 750 × 2,400 = 144, but the student reverses the final step or divides the rate by the time: 2,400 ÷ 45 × 2 + 54 = 108. More directly, this comes from calculating 2,400 × 45 = 108,000 but then stopping and interpreting 108,000 as 108 bottles (forgetting to divide by 750).",
    "C": "This is the correct answer: 2,400 mL/min × 45 min = 108,000 mL total, then 108,000 mL ÷ 750 mL/bottle = 144 bottles.",
    "D": "This answer results from multiplying the rate by the bottle capacity instead of dividing: 2,400 × 750 = 1,800,000, then dividing by some factor, or from calculating 2,400 ÷ 750 = 3.2 bottles per minute, then multiplying 3.2 × 45 = 144, but the student misplaces a decimal or adds an extra zero, getting 1,620. More directly: (2,400 × 45) ÷ 750 × 15 = 1,620."
  },
  "metadata": {
    "generatedAt": "2026-01-09T21:37:33.136Z",
    "promptVersion": "1.2.0",
    "modelUsed": "claude-sonnet-4-5-20250929",
    "generationId": "6ab843f6-5d58-4e7a-879c-f402f8a668a6"
  },
  "hasImage": false,
  "requiresCalculator": false,
  "answerType": "multiple_choice"
}