{
  "id": "a3f7c2d1-85e4-4b9a-9c6f-1d2e3f4a5b6c",
  "topic": {
    "section": "MATH",
    "domain": "Algebra",
    "subtopic": "linear_functions"
  },
  "difficulty": {
    "overall": 1,
    "conceptual": 1.2,
    "procedural": 1,
    "computational": 1.3
  },
  "stem": "A plumber charges customers according to the function $C(h) = 65h + 40$, where $C(h)$ is the total charge in dollars and $h$ is the number of hours worked. What does the value 65 represent in this context?",
  "choices": [
    {
      "label": "A",
      "text": "The total charge for a 1-hour job",
      "isCorrect": false
    },
    {
      "label": "B",
      "text": "The flat fee the plumber charges before starting any work",
      "isCorrect": false
    },
    {
      "label": "C",
      "text": "The plumber's hourly rate, in dollars per hour",
      "isCorrect": true
    },
    {
      "label": "D",
      "text": "The number of hours the plumber works per day",
      "isCorrect": false
    }
  ],
  "correctAnswer": "C",
  "explanation": "In the linear function $C(h) = 65h + 40$, the coefficient of $h$ is the slope, which represents the rate of change. Since $h$ is measured in hours and $C(h)$ is measured in dollars, the slope $65$ represents how much the total charge increases for each additional hour worked — that is, the plumber's hourly rate of $\\$65$ per hour. The constant term $40$ is the y-intercept, representing the flat fee charged regardless of time.",
  "distractorRationale": {
    "A": "Evaluates $C(1) = 65(1) + 40 = 105$, then selects 65 as the charge for a 1-hour job by ignoring the flat fee; the actual 1-hour charge would be $105, not $65.",
    "B": "Confuses the slope (65) with the y-intercept (40); the flat fee is the constant term 40, not the coefficient 65.",
    "D": "Misreads the variable $h$ and treats the coefficient 65 as a quantity of hours rather than a dollar-per-hour rate."
  },
  "hasImage": false,
  "requiresCalculator": false,
  "answerType": "multiple_choice",
  "metadata": {
    "generatedAt": "2026-02-21T00:00:00.000Z",
    "promptVersion": "1.6.0",
    "modelUsed": "claude-sonnet-4-6",
    "generationId": "b1c2d3e4-f5a6-7b8c-9d0e-1f2a3b4c5d6e"
  }
}
