{
  "id": "a3f7b2c1-4d5e-6f7a-8b9c-0d1e2f3a4b5c",
  "topic": {
    "section": "MATH",
    "domain": "Problem_Solving",
    "subtopic": "probability"
  },
  "difficulty": {
    "overall": 1,
    "conceptual": 1.3,
    "procedural": 1,
    "computational": 1
  },
  "stem": "A bag contains 5 red marbles and 3 blue marbles. If one marble is selected at random from the bag, what is the probability that the marble is red?",
  "choices": [
    {
      "label": "A",
      "text": "$\\frac{3}{8}$",
      "isCorrect": false
    },
    {
      "label": "B",
      "text": "$\\frac{1}{2}$",
      "isCorrect": false
    },
    {
      "label": "C",
      "text": "$\\frac{5}{8}$",
      "isCorrect": true
    },
    {
      "label": "D",
      "text": "$\\frac{2}{3}$",
      "isCorrect": false
    }
  ],
  "correctAnswer": "C",
  "explanation": "The probability of an event is calculated as:\n\n$$P(\\text{event}) = \\frac{\\text{number of favorable outcomes}}{\\text{total number of possible outcomes}}$$\n\nIn this problem:\n- Number of red marbles (favorable outcomes) = 5\n- Total number of marbles = 5 + 3 = 8\n\nTherefore:\n$$P(\\text{red}) = \\frac{5}{8}$$\n\nThe answer is $\\frac{5}{8}$.",
  "distractorRationale": {
    "A": "SETUP ERROR - Student uses the number of blue marbles instead of red marbles in the numerator, calculating $\\frac{3}{8}$ (probability of selecting blue instead of red).",
    "B": "COMPUTATIONAL ERROR - Student incorrectly simplifies or miscalculates the total, possibly thinking there are 10 total marbles and computing $\\frac{5}{10} = \\frac{1}{2}$, or incorrectly reducing $\\frac{5}{8}$.",
    "D": "SETUP ERROR - Student uses only the red marbles as the total, calculating $\\frac{5}{5+3}$ but then mistakenly computes $\\frac{5-1}{5+3-2} = \\frac{4}{6} = \\frac{2}{3}$, or divides red by red plus one category: $\\frac{5}{5+3-1} = \\frac{5}{7}$ then rounds, or calculates $\\frac{5}{8}$ but misreads it as $\\frac{2}{3}$. More directly: uses red marbles over non-blue count incorrectly as $\\frac{5}{8-1} \\approx \\frac{2}{3}$ through arithmetic error, or computes the ratio of red to blue as $\\frac{5}{3}$ then tries to convert to probability incorrectly."
  },
  "metadata": {
    "generatedAt": "2026-01-09T21:36:09.746Z",
    "promptVersion": "1.2.0",
    "modelUsed": "claude-sonnet-4-5-20250929",
    "generationId": "cc6853d3-674b-4804-b814-aa3a46277588"
  },
  "hasImage": false,
  "requiresCalculator": false,
  "answerType": "multiple_choice"
}